[
  {
    "manifest": "okibi-service/1",
    "service": "buildings",
    "url_template": "https://buildings.reearth.land/t/{tileset}/{id}?s={epoch.source}",
    "meta_urls": {
      "tileset": "https://buildings.reearth.land/t/{tileset}/tileset.json"
    },
    "cost": {
      "default_gen_ms": 5400,
      "default_bytes": 220133,
      "concurrency_limit": 8,
      "rate_per_s": 4,
      "billing": {
        "pricing_profile": "cloudflare",
        "per_gen": {
          "cpu_ms": 4200,
          "subrequest": 12,
          "storage_class_a": 1,
          "egress_byte": null
        }
      }
    },
    "zoom_semantics": "size_bucket"
  }
]
